{
  "Name": "Personnel",
  "Description": "Advanced personal profile - Gaming + development and power user tools (v3.0.0 - Database Mode)",
  "Version": "3.0.1",
  "Inherits": ["Gaming"],
  "Applications": [
    "VSCode",
    "MobaXterm",
    "Git",
    "WSL2",
    "PuTTY",
    "WinSCP",
    "Wireshark",
    "SysinternalsSuite",
    "Python3",
    "NodeJS",
    "DotNetSDK",
    "YubiKeyManager",
    "SandboxiePlus",
    "LDPlayer",
    "pCloudDrive",
    "GoogleDrive",
    "IDM",
    "ProtonVPN",
    "ProtonDrive",
    "ProtonMailBridge",
    "ProtonPass",
    "Roboform",
    "WinRAR",
    "Mp3tag",
    "MediaMonkey",
    "TVRename"
  ],
  "SystemConfig": {
    "Explorer": {
      "DeveloperMode": true
    },
    "Network": {
      "DeveloperOptimizations": true
    },
    "Security": {
      "DeveloperMode": true
    }
  }
}
