{
  "Name": "Office",
  "Description": "Professional productivity profile - Base + office and collaboration tools (v3.5.0 - Database Mode)",
  "Version": "3.5.0",
  "Inherits": ["Base"],
  "Applications": [
    "Office365",
    "PDFXChangeEditor",
    "SignalDesktop",
    "WhatsAppDesktop",
    "OBSStudio"
  ],
  "SystemConfig": {
    "Performance": {
      "PowerPlan": "Balanced"
    }
  }
}
