{
  "Name": "Gaming",
  "Description": "Gaming optimized profile - Office + gaming platforms (v3.5.9 - Database Mode)",
  "Version": "3.5.9",
  "Inherits": ["Office"],
  "Applications": [
    "Steam",
    "Discord",
    "EpicGamesLauncher",
    "BattleNet"
  ],
  "SystemConfig": {
    "Network": {
      "GamingOptimizations": true
    },
    "Performance": {
      "DisableVisualEffects": true,
      "PowerPlan": "High Performance",
      "GameMode": true
    }
  }
}
